A1: TEST CASE ID | B1: INPUT DATUM(Code) | C1: INPUT PROJECTION | D1: OUTPUT DATUM(Code) | E1: OUTPUT PROJECTION | F1: INPUT ZONE | G1: OUTPUT ZONE | H1: INPUT_COORDS | K1: OUTPUT_COORDS | N1: CALCULATED_OUTPUT_COORDS | R1: INPUT_SYSTEM_PARAMETERS | AB1: OUTPUT_SYSTEM_PARAMETERS | AL1: RESULTS
F2: OR HEMISPHERE | G2: OR HEMISPHERE | H2: Lat, Easting, String or X | I2: Lon, Northing or Y | J2: Height or Z | K2: Lat, Easting, String or X | L2: Lon, Northing or Y | M2: Height or Z | N2: Lat, Easting, String or X | O2: Lon, Northing or Y | P2: Height or Z | Q2: Calculated Zone or Hemisphere | R2: 1st Standard Parallel or Scale Factor | S2: 2nd Standard Parallel | T2: Central Meridian | U2: Origin Latitude | V2: False Easting or Origin Height | W2: False Northing or Orientation | X2: Longitude 1 | Y2: Latitude 1 | Z2: Longitude 2 | AA2: Latitude 2 | AB2: 1st Standard Parallel or Scale Factor | AC2: 2nd Standard Parallel | AD2: Central Meridian | AE2: Origin Latitude | AF2: False Easting or Origin Height | AG2: False Northing or Orientation | AH2: Longitude 1 | AI2: Latitude 1 | AJ2: Longitude 2 | AK2: Latitude 2
A4: 1 | B4: CAC | C4: Albers Equal Area Conic | D4: CAC | E4: Geodetic | H4: 1885472.73 | I4: 1535925 | K4: 34.999999899999999 | L4: -75 | N4: 35 | O4: -75 | R4: 29.5 | S4: 45.5 | T4: -96 | U4: 23 | V4: 0 | W4: 0
A5: =SUM(A4)+1 -> 2 | B5: WGE | C5: Geodetic | D5: WGE | E5: Albers Equal Area Conic | H5: -35 | I5: 75 | K5: -1885428.3910000001 | L5: -1535969.2860000001 | N5: -1885428 | O5: -1535969 | AB5: -29.5 | AC5: -45.5 | AD5: 96 | AE5: -23 | AF5: 0 | AG5: 0
A6: =SUM(A5)+1 -> 3 | B6: CAC | C6: Azimuthal Equidistant | D6: CAC | E6: Geodetic | H6: 117301.69 | I6: -3952686.66 | K6: -80.5 | L6: -90 | N6: n/a | O6: n/a | T6: -96 | U6: -45 | V6: 0 | W6: 0
A7: =SUM(A6)+1 -> 4 | B7: CAC | C7: Geodetic | D7: CAC | E7: Azimuthal Equidistant | H7: -80.5 | I7: -90 | K7: 117301.6902 | L7: -3952686.6639999999 | N7: n/a | O7: n/a | AD7: -96 | AE7: -45 | AF7: 0 | AG7: 0
A8: =SUM(A7)+1 -> 5 | B8: OGB-7 | C8: BNG | D8: OGB-7 | E8: Geodetic | H8: SV 0000000000 | K8: 49.766190000000002 | L8: -7.5564499999999999 | N8: 49.766190000000002 | O8: -7.5564499999999999
A9: =SUM(A8)+1 -> 6 | B9: OGB-7 | C9: Geodetic | D9: OGB-7 | E9: BNG | H9: 49.766190000000002 | I9: -7.5564499999999999 | K9: SV 0000000000 | N9: SV 0000000000
A10: =SUM(A9)+1 -> 7 | B10: WGE | C10: Bonne | D10: WGE | E10: Geodetic | H10: 0 | I10: 5017021.35 | K10: 90 | L10: 96 | N10: 90 | O10: 96 | T10: 96 | U10: 45 | V10: 0 | W10: 0
A11: =SUM(A10)+1 -> 8 | B11: NAR-A | C11: Geodetic | D11: NAR-A | E11: Bonne | H11: -90 | I11: -180 | K11: 0 | L11: -5017021.35 | N11: 0 | O11: -5017021 | AD11: 170 | AE11: -45 | AF11: 0 | AG11: 0
A12: =SUM(A11)+1 -> 9 | B12: CAC | C12: Cassini | D12: CAC | E12: Geodetic | H12: 163071.13 | I12: 335127.59 | K12: 43 | L12: -73 | N12: 43 | O12: -73 | T12: -75 | U12: 40 | V12: 0 | W12: 0
A13: =SUM(A12)+1 -> 10 | B13: WGE | C13: Geodetic | D13: WGE | E13: Cassini | H13: 35 | I13: 110 | K13: 911345.18 | L13: 600525.98 | N13: 911345 | O13: 600526 | AD13: 100 | AE13: 30 | AF13: 0 | AG13: 0
A14: =SUM(A13)+1 -> 11 | B14: CAC | C14: Cylindrical Equal Area | D14: CAC | E14: Geodetic | H14: -332699.83 | I14: 554248.45 | K14: 5 | L14: -78 | N14: 5 | O14: -78 | T14: -75 | U14: 5 | V14: 0 | W14: 0
A15: =SUM(A14)+1 -> 12 | B15: WGE | C15: Geodetic | D15: WGE | E15: Cylindrical Equal Area | H15: 35 | I15: 110 | K15: 964862.8 | L15: 4198673.82 | N15: 964863 | O15: 4198674 | AD15: 100 | AE15: 30 | AF15: 0 | AG15: 0
A16: =SUM(A15)+1 -> 13 | B16: NAR-A | C16: Eckert IV | D16: NAR-A | E16: Geodetic | H16: 469507.99 | I16: -8451143.5700000003 | K16: -89.998670000000004 | L16: 179.99968999999999 | N16: -89.998672999999997 | O16: 179.99969100000001 | T16: 170 | V16: 0 | W16: 0
A17: =SUM(A16)+1 -> 14 | B17: CAC | C17: Geodetic | D17: CAC | E17: Eckert VI | H17: -50 | I17: -75 | K17: 1079006.83 | L17: -6097186.2000000002 | N17: 1079007 | O17: -6097186 | AD17: -90 | AF17: 0 | AG17: 0
A18: =SUM(A17)+1 -> 15 | B18: CAC | C18: Eckert VI | D18: CAC | E18: Geodetic | H18: 1079006.83 | I18: -6097186.2000000002 | K18: -50 | L18: -75 | N18: -50 | O18: -75 | T18: -90 | V18: 0 | W18: 0
A19: =SUM(A18)+1 -> 16 | B19: CAC | C19: Geodetic | D19: CAC | E19: Eckert VI | H19: -50 | I19: -75 | K19: 1079006.83 | L19: -6097186.2000000002 | N19: 1079007 | O19: -6097186 | AD19: -90 | AF19: 0 | AG19: 0
A20: =SUM(A19)+1 -> 17 | B20: WGE | C20: Equidistant Cylindrical | D20: WGE | E20: Geodetic | H20: 962977.4 | I20: 3891826.82 | K20: 35 | L20: 110 | N20: 35 | O20: 110 | T20: 100 | U20: 30 | V20: 0 | W20: 0
A21: =SUM(A20)+1 -> 18 | B21: WGE | C21: Geodetic | D21: WGE | E21: Equidistant Cylindrical | H21: 40 | I21: 90 | K21: -962977.4 | L21: 4447802.08 | N21: -962977 | O21: 4447802 | AD21: 100 | AE21: 30 | AF21: 0 | AG21: 0
A22: =SUM(A21)+1 -> 19 | B22: WGE | C22: Geocentric | D22: WGE | E22: Geodetic | H22: 4446880.2 | I22: 0 | J22: -4416637.73 | K22: -45 | L22: 0 | M22: -100000 | N22: -45 | O22: 0 | P22: -100000
A23: =SUM(A22)+1 -> 20 | B23: WGE | C23: Geodetic | D23: WGE | E23: Geocentric | H23: -90 | I23: 0 | J23: -100000 | K23: 0 | L23: 0 | M23: -6256752.3099999996 | N23: 0 | O23: 0 | P23: -6256752
A24: =SUM(A23)+1 -> 21 | B24: WGE | C24: GEOREF | D24: WGE | E24: Geodetic | H24: UAAA0000000001 | K24: -89.999983 | L24: 90 | N24: -89.999983 | O24: 90
A25: =SUM(A24)+1 -> 22 | B25: WGE | C25: Geodetic | D25: WGE | E25: GEOREF | H25: 45 | I25: -179.99999 | K25: AKAA0000100000 | N25: AKAA0000100000
A26: =SUM(A25)+1 -> 23 | B26: CAC | C26: Gnomonic | D26: CAC | E26: Geodetic | H26: -982934.03 | I26: -1079717.56 | K26: 30 | L26: -110 | N26: n/a | O26: n/a | T26: -100 | U26: 40 | V26: 0 | W26: 0
A27: =SUM(A26)+1 -> 24 | B27: CAC | C27: Geodetic | D27: CAC | E27: Gnomonic | H27: 30 | I27: -110 | K27: -982934.03449999995 | L27: -1079717.5619999999 | N27: n/a | O27: n/a | AD27: -100 | AE27: 40 | AF27: 0 | AG27: 0
A28: =SUM(A27)+1 -> 25 | B28: NAR-A | C28: Lambert Conformal Conic | D28: NAR-A | E28: Geodetic | H28: 139338.16 | I28: -4239869.0039999997 | K28: -85 | L28: 179.99999990000001 | N28: -85 | O28: 180 | R28: -50.5 | S28: -50.5 | T28: 170 | U28: -50.5 | V28: 0 | W28: 0
A29: =SUM(A28)+1 -> 26 | B29: NAR-A | C29: Geodetic | D29: NAR-A | E29: Lambert Conformal Conic | H29: -85 | I29: -180 | K29: 139338.16080000001 | L29: -4239869.0039999997 | N29: 139338 | O29: -4239869 | AB29: -50.5 | AC29: -50.5 | AD29: 170 | AE29: -50.5 | AF29: 0 | AG29: 0
A30: =SUM(A29)+1 -> 27 | B30: WGE | C30: Local Cartesian | D30: WGE | E30: Geodetic | H30: 2904699 | I30: 4862789 | J30: -3473438 | K30: 50 | L30: 45 | N30: 50 | O30: 45 | T30: 0 | U30: 0 | V30: 0 | W30: 0
A31: =SUM(A30)+1 -> 28 | B31: WGE | C31: Geodetic | D31: WGE | E31: Local Cartesian | H31: 50 | I31: 45 | K31: 2904699 | L31: 4862789 | M31: -3473438 | N31: 2904699 | O31: 4862789 | P31: -3473438 | AD31: 0 | AE31: 0 | AF31: 0 | AG31: 0
A32: =SUM(A31)+1 -> 29 | B32: CAC | C32: Mercator | D32: CAC | E32: Geodetic | H32: 11688673.720000001 | I32: 4139145.66 | K32: 35 | L32: -75 | N32: 35 | O32: -75 | T32: -180 | U32: 0 | V32: 0 | W32: 0
A33: =SUM(A32)+1 -> 30 | B33: CAC | C33: Geodetic | D33: CAC | E33: Mercator | H33: 35 | I33: -75 | K33: 11688673.720000001 | L33: 4139145.66 | N33: 11688674 | O33: 4139146 | AD33: -180 | AE33: 0 | AF33: 0 | AG33: 0
A34: =SUM(A33)+1 -> 31 | B34: WGE | C34: MGRS | D34: WGE | E34: Geodetic | H34: ZAH0000000000 | K34: 90 | L34: 180 | N34: 90 | O34: 0
A35: =SUM(A34)+1 -> 32 | B35: WGE | C35: Geodetic | D35: WGE | E35: MGRS | H35: -90 | I35: 180 | K35: BAN0000000000 | N35: BAN0000000000
A36: =SUM(A35)+1 -> 33 | B36: CAC | C36: Mollweide | D36: CAC | E36: Geodetic | H36: 1139672.59 | I36: -5866897.1200000001 | K36: -50 | L36: -75 | N36: -50 | O36: -75 | T36: -90 | V36: 0 | W36: 0
A37: =SUM(A36)+1 -> 34 | B37: WGE | C37: Geodetic | D37: WGE | E37: Mollweide | H37: 35 | I37: 110 | K37: 884598.74 | L37: 4218501.64 | N37: 884599 | O37: 4218502 | AD37: 100 | AF37: 0 | AG37: 0
A38: =SUM(A37)+1 -> 35 | B38: WGE | C38: Neys | D38: WGE | E38: Geodetic | H38: 8050247 | I38: 26775888 | K38: -41 | L38: 173 | N38: -41 | O38: 173 | R38: 71 | T38: 10 | U38: 80 | V38: 0 | W38: 0
A39: =SUM(A38)+1 -> 36 | B39: WGE | C39: Geodetic | D39: WGE | E39: Neys | H39: -41 | I39: 173 | K39: 8050247 | L39: 26775888 | N39: 8050247 | O39: 26775888 | AB39: 71 | AD39: 10 | AE39: 80 | AF39: 0 | AG39: 0
A40: =SUM(A39)+1 -> 37 | B40: EUR-7 | C40: NZMG | D40: EUR-7 | E40: Geodetic | H40: 2510000 | I40: 6023150 | K40: -41 | L40: 173 | N40: -41 | O40: 173
A41: =SUM(A40)+1 -> 38 | B41: EUR-7 | C41: Geodetic | D41: EUR-7 | E41: NZMG | H41: -41 | I41: 173 | K41: 2510000 | L41: 6023150 | N41: 2510000 | O41: 6023150
A42: =SUM(A41)+1 -> 39 | B42: CAC | C42: Oblique Mercator | D42: CAC | E42: Geodetic | H42: 6269400.2810000004 | I42: 916375.31059999997 | K42: 40.799999900000003 | L42: -73.999999799999998 | N42: n/a | O42: n/a | R42: 0.99960000000000004 | U42: 40 | V42: 4000000 | W42: 500000 | X42: -122.3 | Z42: 47.5 | AA42: -80.2 | AB42: 25.7
A43: =SUM(A42)+1 -> 40 | B43: CAC | C43: Geodetic | D43: CAC | E43: Oblique Mercator | H43: 40.8 | I43: -74 | K43: 6269400.2810000004 | L43: 916375.31059999997 | N43: n/a | O43: n/a | AB43: 0.99960000000000004 | AE43: 40 | AF43: 4000000 | AG43: 500000 | AH43: -122.3 | AI43: 47.5 | AJ43: -80.2 | AK43: 25.7
A44: =SUM(A43)+1 -> 41 | B44: CAC | C44: Orthographic | D44: CAC | E44: Geodetic | H44: 19307.81 | I44: -109500.01 | K44: 89 | L44: 110.00000199999999 | N44: 89 | O44: 110.00000199999999 | T44: 100 | U44: 90 | V44: 0 | W44: 0
A45: =SUM(A44)+1 -> 42 | B45: CAC | C45: Geodetic | D45: CAC | E45: Orthographic | H45: 30.5 | I45: -80.5 | K45: 906018.40079999994 | L45: -1541936.199 | N45: 906018 | O45: -1541936 | AD45: -90 | AE45: 45 | AF45: 0 | AG45: 0
A46: =SUM(A45)+1 -> 43 | B46: NAR-A | C46: Polar Stereographic | D46: NAR-A | E46: Geodetic | H46: 82849.62 | I46: 469863.56 | K46: -85 | L46: 179.99999969999999 | N46: -85 | O46: 180 | T46: 170 | U46: -45 | V46: 0 | W46: 0
A47: =SUM(A46)+1 -> 44 | B47: NAR-A | C47: Geodetic | D47: NAR-A | E47: Polar Stereographic | H47: -85 | I47: -180 | K47: 82849.623590000003 | L47: 469863.56400000001 | N47: 82850 | O47: 469864 | AD47: 170 | AE47: -45 | AF47: 0 | AG47: 0
A48: =SUM(A47)+1 -> 45 | B48: CAC | C48: Polyconic | D48: CAC | E48: Geodetic | H48: 7915329.1960000005 | I48: 8465107.0659999996 | K48: 35 | L48: -75 | N48: 35 | O48: -75 | T48: -180 | U48: 0 | V48: 0 | W48: 0
A49: =SUM(A48)+1 -> 46 | B49: CAC | C49: Geodetic | D49: CAC | E49: Polyconic | H49: 35 | I49: -75 | K49: 7915329.1960000005 | L49: 8465107.0659999996 | N49: 7915329 | O49: 8465107 | AD49: -180 | AE49: 0 | AF49: 0 | AG49: 0
A50: =SUM(A49)+1 -> 47 | B50: WGE | C50: Sinusoidal | D50: WGE | E50: Geodetic | H50: -1917051.56 | I50: -3874592.9 | K50: -35 | L50: 75 | N50: -35 | O50: 75 | T50: 96 | V50: 0 | W50: 0
A51: =SUM(A50)+1 -> 48 | B51: WGE | C51: Geodetic | D51: WGE | E51: Sinusoidal | H51: -35 | I51: 75 | K51: -1917051.56 | L51: -3874592.9 | N51: -1917052 | O51: -3874593 | AD51: 96 | AF51: 0 | AG51: 0
A52: =SUM(A51)+1 -> 49 | B52: CAC | C52: Stereographic | D52: CAC | E52: Geodetic | H52: -56065.07 | I52: -1170804.42 | K52: -0.4999999 | L52: -0.5 | N52: n/a | O52: n/a | T52: 0 | U52: 10 | V52: 0 | W52: 0
A53: =SUM(A52)+1 -> 50 | B53: CAC | C53: Geodetic | D53: CAC | E53: Stereographic | H53: -0.5 | I53: -0.5 | K53: -56065.073080000002 | L53: -1170804.4280000001 | N53: n/a | O53: n/a | AD53: 0 | AE53: 10 | AF53: 0 | AG53: 0
A54: =SUM(A53)+1 -> 51 | B54: WGE | C54: Transverse Cylindrical Equal Area | D54: WGE | E54: Geodetic | H54: 0 | I54: 5017021.35 | K54: 90 | L54: 96 | N54: 90 | O54: 96 | R54: 1 | T54: 96 | U54: 45 | V54: 0 | W54: 0
A55: =SUM(A54)+1 -> 52 | B55: WGE | C55: Geodetic | D55: WGE | E55: Transverse Cylindrical Equal Area | H55: 90 | I55: 90 | K55: 0 | L55: 5017021.35 | N55: 0 | O55: 5017021 | AB55: 1 | AD55: 96 | AE55: 45 | AF55: 0 | AG55: 0
A56: =SUM(A55)+1 -> 53 | B56: WGE | C56: Transverse Mercator | D56: WGE | E56: Geodetic | H56: -13606 | I56: 4904197 | K56: 89 | L56: 89 | N56: 89.000011000000001 | O56: 88.999893 | R56: 0.99960000000000004 | T56: 96 | U56: 45 | V56: 0 | W56: 0
A57: =SUM(A56)+1 -> 54 | B57: WGE | C57: Geodetic | D57: WGE | E57: Transverse Mercator | H57: 89 | I57: 89 | K57: -13606 | L57: 4904197 | N57: -13605.942880000001 | O57: 4904197.4040000001 | AB57: 0.99960000000000004 | AD57: 96 | AE57: 45 | AF57: 0 | AG57: 0
A58: =SUM(A57)+1 -> 55 | B58: WGE | C58: UPS | D58: WGE | E58: Geodetic | F58: N | H58: 2000000 | I58: 1355534 | K58: 84.2 | L58: 0 | N58: 84.200002999999995 | O58: 0
A59: =SUM(A58)+1 -> 56 | B59: WGE | C59: Geocentric | D59: WGC | E59: UPS | G59: N | H59: 0 | I59: 167521 | J59: 6354559 | K59: 2166544 | L59: 2000000 | N59: 2166544 | O59: 2000000 | Q59: N
A60: =SUM(A59)+1 -> 57 | B60: MIN-B | C60: UTM | D60: MPO | E60: GEOREF | F60: -31 | H60: 166109 | I60: 9999878 | K60: NFAQ0007059977 | N60: NFAQ0007059977
A61: =SUM(A60)+1 -> 58 | B61: NAR-A | C61: Mercator | D61: NAR-A | E61: UTM | G61: 1 | H61: -19735085.530000001 | I61: 0 | K61: 166021 | L61: 0 | N61: 166021 | O61: 0 | Q61: 1 | T61: 0 | U61: -10 | V61: 0 | W61: 0
A62: =SUM(A61)+1 -> 59 | B62: WGC | C62: Van der Grinten | D62: WGC | E62: Geodetic | H62: -443488.39 | I62: 18037718.039999999 | K62: 89.5 | L62: 75 | N62: 89.5 | O62: 75 | T62: 96 | V62: 0 | W62: 0
A63: =SUM(A62)+1 -> 60 | B63: WGC | C63: Geodetic | D63: WGC | E63: Van der Grinten | H63: 89.5 | I63: 75 | K63: -443488.39 | L63: 18037718.039999999 | N63: -443488 | O63: 18037718 | AD63: 96 | AF63: 0 | AG63: 0
A64: =SUM(A63)+1 -> 61 | B64: WGE | C64: Geodetic | D64: TIL | E64: Geodetic | H64: 1.91032 | I64: 112.8703 | J64: 1206.32 | K64: 1.9109087 | L64: 112.8670144 | M64: 1188.56 | N64: 1.910909 | O64: 112.86701499999999 | P64: 1189